{
  "schemaVersion": "1.0",
  "project": {
    "name": "EngineeringOS",
    "version": "1.0.0",
    "description": "Personal Engineering Knowledge Platform powered by Local AI"
  },
  "folders": [
    {
      "path": ".github",
      "description": "GitHub repository automation and CI configuration"
    },
    {
      "path": ".github/workflows",
      "description": "GitHub Actions workflow definitions"
    },
    {
      "path": "ADR",
      "description": "Architecture Decision Records"
    },
    {
      "path": "docs",
      "description": "Project Documentation"
    },
    {
      "path": "docs/webui-screenshots",
      "description": "Deterministic visual-regression evidence for the governed WebUI"
    },
    {
      "path": "career",
      "description": "Career Planning and Job Market References"
    },
    {
      "path": "career/profile",
      "description": "Canonical Professional Profile and CV Source Content"
    },
    {
      "path": "career/job-market",
      "description": "Job Market References"
    },
    {
      "path": "career/job-market/CMC_Global",
      "description": "CMC Global Job Market References"
    },
    {
      "path": "templates",
      "description": "Project Templates"
    },
    {
      "path": "scripts",
      "description": "Automation Scripts"
    },
    {
      "path": "configs",
      "description": "Configuration"
    },
    {
      "path": "configs/ai",
      "description": "Canonical AI provider, model, and runtime configuration"
    },
    {
      "path": "agents",
      "description": "AI Agents"
    },
    {
      "path": "runtime",
      "description": "Local AI Runtime"
    },
    {
      "path": "memory",
      "description": "Persistent AI Memory"
    },
    {
      "path": "logs",
      "description": "Execution Logs"
    },
    {
      "path": "tests",
      "description": "Tests"
    },
    {
      "path": "experiments",
      "description": "Experiments"
    },
    {
      "path": "prompts",
      "description": "Prompt Library"
    },
    {
      "path": "tools",
      "description": "External Tools"
    },
    {
      "path": "knowledge",
      "description": "Engineering Knowledge Repository"
    },
    {
      "path": "knowledge/inbox",
      "description": "Governed destination for imported Markdown and plain-text knowledge"
    },
    {
      "path": "knowledge/architecture",
      "description": "Architecture Knowledge"
    },
    {
      "path": "knowledge/architecture/patterns",
      "description": "Architecture Patterns"
    },
    {
      "path": "knowledge/architecture/styles",
      "description": "Architecture Styles"
    },
    {
      "path": "knowledge/architecture/system-designs",
      "description": "System Designs"
    },
    {
      "path": "knowledge/architecture/reviews",
      "description": "Architecture Reviews"
    },
    {
      "path": "knowledge/standards",
      "description": "Engineering Standards"
    },
    {
      "path": "knowledge/standards/iSAQB",
      "description": "iSAQB"
    },
    {
      "path": "knowledge/standards/ISO26262",
      "description": "ISO26262"
    },
    {
      "path": "knowledge/standards/AUTOSAR",
      "description": "AUTOSAR"
    },
    {
      "path": "knowledge/standards/ASPICE",
      "description": "ASPICE"
    },
    {
      "path": "knowledge/software-engineering",
      "description": "Software Engineering"
    },
    {
      "path": "knowledge/automotive",
      "description": "Automotive Engineering"
    },
    {
      "path": "knowledge/automotive/EOS_SDV_Vehicle_Status_2026-09-08",
      "description": "Source-aware SDV Vehicle Status project context package"
    },
    {
      "path": "knowledge/automotive/EOS_SDV_Vehicle_Status_2026-09-08/current",
      "description": "Current SDV Vehicle Status context and deliverables"
    },
    {
      "path": "knowledge/automotive/EOS_SDV_Vehicle_Status_2026-09-08/history",
      "description": "Superseded SDV Vehicle Status versions and evolution records"
    },
    {
      "path": "knowledge/automotive/EOS_SDV_Vehicle_Status_2026-09-08/history/v0_9",
      "description": "Archived SDV Vehicle Status v0.9 proposal"
    },
    {
      "path": "knowledge/automotive/EOS_SDV_Vehicle_Status_2026-09-08/history/v1_0",
      "description": "Archived SDV Vehicle Status v1.0 proposal"
    },
    {
      "path": "knowledge/automotive/EOS_SDV_Vehicle_Status_2026-09-08/history/v1_1",
      "description": "Archived SDV Vehicle Status v1.1 proposal and planning artifacts"
    },
    {
      "path": "knowledge/automotive/EOS_SDV_Vehicle_Status_2026-09-08/metadata",
      "description": "Integrity, ingestion, and archival metadata for the SDV package"
    },
    {
      "path": "knowledge/automotive/EOS_SDV_Vehicle_Status_2026-09-08/source",
      "description": "Original SDV Vehicle Status planning source"
    },
    {
      "path": "knowledge/management",
      "description": "Requirement, Scrum and Stakeholder"
    },
    {
      "path": "knowledge/personal",
      "description": "Personal Engineering Knowledge"
    },
    {
      "path": "knowledge/personal/lessons-learned",
      "description": "Lessons Learned"
    },
    {
      "path": "knowledge/personal/architecture-notes",
      "description": "Architecture Notes"
    },
    {
      "path": "knowledge/personal/checklists",
      "description": "Engineering Checklists"
    },
    {
      "path": "knowledge/personal/tradeoffs",
      "description": "Architecture Trade-offs"
    },
    {
      "path": "knowledge/projects",
      "description": "Project Knowledge"
    },
    {
      "path": "docs/proposals",
      "description": "Bản đề xuất đang chờ chủ project duyệt, kèm tác động và patch nếu cần"
    },
    {
      "path": "engineering_os",
      "description": "Mã Python của EngineeringOS: CLI, cấu hình, tạo/kiểm tra cấu trúc, runtime abstraction và tìm kiếm Markdown"
    },
    {
      "path": "engineering_os/web_static",
      "description": "Tài sản giao diện trình duyệt cục bộ cho HTTP adapter EngineeringOS"
    },
    {
      "path": "skills",
      "description": "Nguồn chính cho workflow AI tái sử dụng"
    },
    {
      "path": "skills/analyze-job-description",
      "description": "Package phân tích JD"
    },
    {
      "path": "skills/career-direction-review",
      "description": "Package đánh giá định hướng nghề nghiệp"
    },
    {
      "path": "skills/code-review",
      "description": "Bounded source and diff review workflow"
    },
    {
      "path": "skills/requirement-review",
      "description": "Requirement quality review workflow"
    },
    {
      "path": "skills/adr-assistant",
      "description": "Unapproved ADR drafting workflow"
    },
    {
      "path": "skills/solution-architect",
      "description": "Bounded solution architecture proposal workflow"
    },
    {
      "path": "knowledge/architect",
      "description": "Chương trình học Architect cá nhân hiện có"
    },
    {
      "path": "knowledge/architect/asr",
      "description": "Ghi chú ASR trong chương trình Architect và các nghiên cứu thiết kế local AI hiện hữu"
    },
    {
      "path": "knowledge/architect/books",
      "description": "Sách, nguồn đọc và kế hoạch đọc liên quan chương trình Architect"
    },
    {
      "path": "knowledge/architect/lessions",
      "description": "Bài học, review, appendix và ghi chú gắn với chương trình Architect"
    }
  ],
  "files": [
    {
      "path": ".github/workflows/ci.yml",
      "template": "EMPTY"
    },
    {
      "path": "README.md",
      "template": "README"
    },
    {
      "path": ".gitignore",
      "template": "GITIGNORE"
    },
    {
      "path": "LICENSE",
      "template": "LICENSE"
    },
    {
      "path": "ADR/README.md",
      "template": "ADR_README"
    },
    {
      "path": "career/README.md",
      "template": "CAREER_README"
    },
    {
      "path": "career/Career_Plan_v1.0.md",
      "template": "EMPTY"
    },
    {
      "path": "career/career-direction-sa-vs-fo.md",
      "template": "EMPTY"
    },
    {
      "path": "career/profile/Dao_Pham_CV_Content_for_AI_v4.md",
      "template": "EMPTY"
    },
    {
      "path": "docs/ROADMAP.md",
      "template": "EMPTY"
    },
    {
      "path": "docs/PRODUCT_BACKLOG.md",
      "template": "EMPTY"
    },
    {
      "path": "docs/ARCHITECTURE.md",
      "template": "EMPTY"
    },
    {
      "path": "docs/CHANGELOG.md",
      "template": "EMPTY"
    },
    {
      "path": "docs/DECISIONS.md",
      "template": "EMPTY"
    }
  ],
  "governance": {
    "readmeName": "README.md",
    "protectedRootReadme": {
      "path": "README.md",
      "sha256": "80a24bdf97de7195932877fbcf390b8b9f2d0f01f6c7db10e34c96523cd0f00d"
    },
    "ignoredDirectories": [
      ".git",
      ".venv",
      "venv",
      "engineering_os.egg-info",
      "__pycache__",
      ".pytest_cache",
      ".vscode",
      ".idea",
      "tmp",
      "temp",
      "coverage",
      "logs",
      "runtime/vector-db",
      "runtime/cache",
      "runtime/index"
    ],
    "allowedRootFiles": [
      "README.md",
      "AGENTS.md",
      ".gitignore",
      "LICENSE",
      "eng.py",
      "pyproject.toml"
    ]
  }
}
